{
  "$schema": "../../packages/manifest/game.schema.json",
  "id": "phaser-2d",
  "title": "Звездопад",
  "version": "1.1.1",
  "description": "Демо на Phaser 4: лови падающие звёзды. Эталон игры vite-ts на 2D-движке, работает офлайн.",
  "kind": "static",
  "toolchain": "vite-ts",
  "output": "dist",
  "entry": "index.html",
  "offline": true,
  "permissions": [
    "saves",
    "leaderboard",
    "fullscreen"
  ],
  "tags": [
    "arcade",
    "phaser",
    "keyboard",
    "touch"
  ],
  "cover": "cover.svg",
  "authors": [
    "sirrorist"
  ]
}
