{
  "$schema": "../../packages/manifest/game.schema.json",
  "id": "superwalk",
  "title": "Superwalk",
  "version": "1.1.0",
  "description": "Лис бежит по солнечным холмам: оружие бьёт само, из врагов сыплется опыт, на каждом уровне - выбор улучшения, в конце - босс. На ПК и на телефоне.",
  "kind": "static",
  "toolchain": "vite-ts",
  "output": "dist",
  "entry": "index.html",
  "offline": true,
  "permissions": [
    "saves",
    "leaderboard",
    "fullscreen",
    "pointer-lock",
    "orientation-lock"
  ],
  "tags": [
    "3d",
    "roguelite",
    "survival"
  ],
  "cover": "cover.svg"
}
